[
  {
    "outlet": "WHRO Public Media",
    "outletShort": "WHRO",
    "title": "Through 757 Tech, developers and programmers in Hampton Roads find community",
    "url": "https://www.whro.org/business-growth/2026-09-02/through-757-tech-developers-and-programmers-in-hampton-roads-find-community",
    "date": "2026-09-02",
    "author": "Ashley White",
    "summary": "WHRO followed 757 Tech from a Norfolk JavaScript meetup to HTML Day, on how a volunteer-run network of meetups became the region's on-ramp into tech.",
    "quote": "Everybody in this community has been the warmest, most wholesome group of people that I think I've ever met.",
    "quoteBy": "Chazona Baum",
    "quoteRole": "Late Night Builders"
  }
]
